{
  "$schema": "https://json-schema.org/draft/2020-12/schema",
  "$id": "https://forgerail.dev/schemas/adoption-plan-v1.json",
  "title": "ForgeRail Adoption Plan",
  "$comment": "Before approval or applying any write, validate the complete plan with ForgeRail validateContract('adoption-plan', plan). Runtime validation additionally rejects case-folded duplicate and ancestor/descendant target paths and reserved shared-contract collisions; standard JSON Schema cannot compare arbitrary path strings across entries. Supported shared-Core Cursor plans carry AGENTS.md content and project/package Core digests. A received Cursor no-change claim also requires verifyCursorNoChangePlan(workspace, plan); covered writes recheck current files and package Core at apply time. Structural validation alone does not independently verify workspace files or host behavior.",
  "type": "object",
  "additionalProperties": false,
  "required": ["schemaVersion", "planId", "workspace", "currentLevel", "proposedLevel", "strategy", "hostSelection", "evidence", "proposedWrites", "requiredConfirmation", "verification", "confirmedNonMutations", "mutations", "status"],
  "properties": {
    "schemaVersion": { "const": "1.0" },
    "planId": { "type": "string", "pattern": "^[a-zA-Z0-9][a-zA-Z0-9._:-]+$" },
    "workspace": { "type": "string", "minLength": 1 },
    "currentLevel": { "enum": ["plugin-only", "lightweight-adoption", "persisted-governance"] },
    "proposedLevel": { "enum": ["plugin-only", "lightweight-adoption", "persisted-governance"] },
    "strategy": { "enum": ["no-change", "single-host-managed-block", "shared-contract-with-thin-bindings"] },
    "hostSelection": {
      "type": "object",
      "additionalProperties": false,
      "required": ["mode", "hosts"],
      "properties": {
        "mode": { "enum": ["explicit", "all-detected", "all-available"] },
        "hosts": {
          "type": "object",
          "minProperties": 1,
          "propertyNames": { "pattern": "^[a-z][a-z0-9-]+$" },
          "additionalProperties": {
            "type": "object",
            "additionalProperties": false,
            "required": ["status", "bindingTarget", "verificationMode"],
            "properties": {
              "status": { "enum": ["supported", "profile-only"] },
              "bindingTarget": { "type": "string", "minLength": 1, "pattern": "^(?![\\\\/])(?![a-zA-Z]:)(?!.*//)(?!.*(?:^|/)\\.(?:/|$))(?!.*(?:^|/)\\.\\.(?:/|$))(?!.*(?:^|/)[^/]*\\.(?:/|$))(?!.*(?:^|/)(?:[Cc][Oo][Nn]|[Pp][Rr][Nn]|[Aa][Uu][Xx]|[Nn][Uu][Ll]|[Cc][Oo][Mm][1-9]|[Ll][Pp][Tt][1-9])(?:\\.|/|$))(?!.*/$)[A-Za-z0-9._-]+(?:/[A-Za-z0-9._-]+)*$" },
              "verificationMode": { "enum": ["new-task-discovery", "profile-only"] }
            },
            "allOf": [
              {
                "if": { "properties": { "status": { "const": "supported" } }, "required": ["status"] },
                "then": { "properties": { "verificationMode": { "const": "new-task-discovery" } } }
              },
              {
                "if": { "properties": { "status": { "const": "profile-only" } }, "required": ["status"] },
                "then": { "properties": { "verificationMode": { "const": "profile-only" } } }
              }
            ]
          }
        }
      }
    },
    "evidence": { "type": "array", "items": { "type": "string", "minLength": 1 }, "minItems": 1, "uniqueItems": true },
    "cursorCoverage": {
      "type": "object",
      "additionalProperties": false,
      "required": ["workspaceSha256", "agentsContent", "agentsSha256", "coreSha256", "sourceCoreSha256"],
      "properties": {
        "workspaceSha256": { "type": "string", "pattern": "^[0-9a-f]{64}$" },
        "agentsContent": { "type": "string", "minLength": 1 },
        "agentsSha256": { "type": "string", "pattern": "^[0-9a-f]{64}$" },
        "coreSha256": { "type": "string", "pattern": "^[0-9a-f]{64}$" },
        "sourceCoreSha256": { "type": "string", "pattern": "^[0-9a-f]{64}$" }
      }
    },
    "proposedWrites": {
      "type": "array",
      "items": {
        "type": "object",
        "additionalProperties": false,
        "required": ["workspaceSha256", "path", "operation", "baseSha256", "contentSha256", "content", "managedMarker", "approvalSha256"],
        "properties": {
          "workspaceSha256": { "type": "string", "pattern": "^[0-9a-f]{64}$" },
          "path": { "type": "string", "minLength": 1, "pattern": "^(?![\\\\/])(?![a-zA-Z]:)(?!.*//)(?!.*(?:^|/)\\.(?:/|$))(?!.*(?:^|/)\\.\\.(?:/|$))(?!.*(?:^|/)[^/]*\\.(?:/|$))(?!.*(?:^|/)(?:[Cc][Oo][Nn]|[Pp][Rr][Nn]|[Aa][Uu][Xx]|[Nn][Uu][Ll]|[Cc][Oo][Mm][1-9]|[Ll][Pp][Tt][1-9])(?:\\.|/|$))(?!.*/$)[A-Za-z0-9._-]+(?:/[A-Za-z0-9._-]+)*$" },
          "operation": { "enum": ["create", "append-managed-block", "replace-managed-block"] },
          "baseSha256": { "type": ["string", "null"], "pattern": "^[0-9a-f]{64}$" },
          "contentSha256": { "type": "string", "pattern": "^[0-9a-f]{64}$" },
          "content": { "type": "string", "minLength": 1 },
          "managedMarker": { "type": "string", "pattern": "^forgerail:(binding:[a-z][a-z0-9-]+|adoption-contract):v1$" },
          "approvalSha256": { "type": "string", "pattern": "^[0-9a-f]{64}$" },
          "coverage": {
            "type": "object",
            "additionalProperties": false,
            "required": ["agentsSha256", "coreSha256", "sourceCoreSha256"],
            "properties": {
              "agentsSha256": { "type": "string", "pattern": "^[0-9a-f]{64}$" },
              "coreSha256": { "type": "string", "pattern": "^[0-9a-f]{64}$" },
              "sourceCoreSha256": { "type": "string", "pattern": "^[0-9a-f]{64}$" }
            }
          }
        }
      }
    },
    "requiredConfirmation": { "const": true },
    "verification": { "type": "array", "items": { "type": "string", "minLength": 1 }, "minItems": 1, "uniqueItems": true },
    "confirmedNonMutations": { "type": "array", "items": { "type": "string", "minLength": 1 }, "minItems": 1, "uniqueItems": true },
    "mutations": { "type": "array", "maxItems": 0 },
    "status": { "const": "candidate" }
  }
}
